<?xml version="1.0" encoding="UTF-8"?>
<!DOCTYPE concesionario SYSTEM "Practica8.1.dtd">

<concesionario>

    <coche>
        <marca modelo="León">SEAT</marca>
        <matricula>1234BBB</matricula>
        <potencia combustible="gasoil">130</potencia>
        <numPlazas>5</numPlazas>
        <numPuertas>5</numPuertas>
        <bajasEmisiones CO2="5"/> 
    </coche>
        
    <coche>
        <marca modelo="406">Peugeot</marca>
        <matricula>9067DYC</matricula>
        <potencia combustible="gasolina">90</potencia>
        <numPlazas>5</numPlazas>
        <numPuertas>4</numPuertas>
        <bajasEmisiones CO2=""/>
    </coche>

    <coche> 
        <marca modelo="serie 1">BMW</marca>
        <matricula>5678CCC</matricula>
        <potencia combustible="gasoil">150</potencia>
        <numPlazas>4</numPlazas>
        <numPuertas>3</numPuertas>
        <bajasEmisiones CO2=""/>
    </coche>

</concesionario>
